{
  "run_id": "2026-06-27T15-38-46Z",
  "date": "2026-06-27T15:38:46.548823",
  "mode": "golden",
  "sessions_evaluated": 0,
  "items_proposed": 0,
  "accepted": 0,
  "rejected": 0,
  "edited": 0,
  "deferred": 0,
  "rolled_back": {
    "pref": 0,
    "workflow": 0,
    "skill": 0,
    "subagent": 0,
    "rule": 0
  },
  "acceptance_rate": {},
  "precision": 0.0,
  "recall": 0.0,
  "recurrence_calibration": 0.0,
  "faithfulness_score": 0.0,
  "secret_leak_test": "skip",
  "regret_rate": null,
  "token_cost": 0,
  "latency": 0,
  "soul_version": null,
  "agents_md_hash_before": null,
  "agents_md_hash_after": null
}